materac,cena,link,zdjecie,info,opis
Fandango,"1399,99",https://www.youtube.com/embed/njMj7sY81Ws,https://hilding.pl/png/product/fandango.jpg,https://hilding.pl/produkt/materace-kieszeniowe-_23/hilding-fandango_41.html ,Fandango to uniwersalny materac oferuj?cy doskona?e wsparcie oraz podwy?szon? twardo?? przy jednoczesnym zachowaniu optymalnej elastyczno?ci. Polecamy go osobom o wi?kszej wadze oraz wszystkim preferuj?cym sen na nieco twardszym pod?o?u.
Step,"2399,99",https://www.youtube.com/embed/12IVRddvIlM,https://hilding.pl/png/product/step.jpg,https://hilding.pl/produkt/materace-kieszeniowe-_23/hilding-fandango_41.html ,"Step to materac, który zbudowali?my na bazie spr??yny kieszeniowej. Jego wybór zapewnia doskona?? elastyczno?? oraz wsparcie poszczególnych partii cia?a. Ka?da spr??ynka wewn?trz wk?adu pracuje osobno – uginaj? si? tylko te cz??ci, na które wywierasz najwi?kszy nacisk. Takie rozwi?zanie ogranicza przenoszenie drga?, dzi?ki czemu nie musisz obawia? si?, ?e obudzisz ?pi?cego obok partnera. "
Zorba,"3399,99",https://www.youtube.com/embed/M_mOCNpPsSA,https://hilding.pl/png/product/zorba.jpg,https://hilding.pl/produkt/materace-kieszeniowe-_23/hilding-pasodoble_39.html ,"Zorba to materac, w którym wykorzystali?my wyj?tkowe w?a?ciwo?ci 7-strefowej spr??yny kieszeniowej. Jej konstrukcja zapewnia doskona?e dopasowanie do anatomicznej budowy Twojego cia?a. G?owa, ramiona, biodra i nogi zyskuj? w?a?ciwe podparcie, dzi?ki czemu niezale?nie od pozycji czujesz si? komfortowo."
Breakdance,"4399,99",https://www.youtube.com/embed/1_-GMcbhMx8,https://hilding.pl/png/product/breakdance.jpg,https://hilding.pl/produkt/materace-mlodziezowe_6/hilding-breakdance_46.html ,"Breakdance to materac, który stworzyli?my z my?l? o maksymalnym komforcie nastolatków w wieku szkolnym. Stabilny wk?ad skonstruowali?my z dwóch wysoce elastycznych i przewiewnych pianek Flexifoam, które charakteryzuj? si? nieco inn? twardo?ci?. Dlatego je?li chcesz zapewni? dziecku mocniejsze i nieco twardsze wsparcie, wystarczy odwróci? materac na drug? stron?. Odpowiednie ci?cie i profilowanie pianek  gwarantuje bardzo dobr? wentylacj?, co wp?ywa pozytywnie na trwa?o?? i zachowanie wszystkich cech u?ytkowych materaca."
Dobranocka,"5399,99",,https://hilding.pl/png/product/dobranocka.jpg,https://hilding.pl/produkt/materace-mlodziezowe_6/hilding-breakdance_46.html ,"Dobranocka to nasz sprawdzony i popularny materac dla najm?odszych. Wykonali?my go z elastycznej i przewiewnej pianki Flexifoam. Jej porowata struktura oraz dodatkowe naci?cia u?atwiaj? dobr? wentylacj? ca?ego wk?adu, dzi?ki czemu materac „oddycha” i zachowuje najwa?niejsze cechy u?ytkowe przez ca?y okres u?ytkowania."
KoÅ‚ysanka,"6399,99",,https://hilding.pl/png/product/kolysanka.jpg,https://hilding.pl/produkt/materace-dzieciece_7/hilding-kolysanka_48.html ,"Ko?ysanka to materac dwustronny, utwardzony warstw? kokosu, ze wzgl?dów higienicznych ukryty pod warstw? przewiewnej i elastycznej pianki Flexifoam. Oferuje dwa ró?ne wsparcia dla dziecka: bardziej mi?kkie i bardziej twarde. Ko?ysanka to materac dla wszystkich zwolenników twardych materaców dla swoich pociech."
Safety Smyk,"7399,99",,https://hilding.pl/png/product/safetysmyk.jpg,https://hilding.pl/produkt/materace-dzieciece_7/hilding-safety-smyk_49.html ,"Safety Smyk to unikatowe na polskim rynku rozwi?zanie, przygotowane z my?l? o bezpiecze?stwie Twojego maluszka. Wk?ad materaca zosta? tak wyprofilowany, ?e zewn?trzne jego kraw?dzie s? wy?sze od blatu materaca, a ca?o?? ma kszta?t ?ódeczki. Materac jest bardzo bezpieczny, dziecku trudniej z niego wypa??. Dzi?ki temu Safety Smyk mo?na wykorzystywa? nie tylko w ?ó?eczku. Mo?e by? zabierany na wakacje, na wypady z dzieckiem do znajomych czy s?u?y? jako przewijak."
Melody,"8399,99",,,,
Foxtrot,"9399,99",,https://hilding.pl/png/product/foxtrot.jpg,https://hilding.pl/produkt/materace-dzieciece_7/hilding-safety-smyk_49.html ,
Rock&Roll,"10399,99",https://www.youtube.com/embed/G3UGBHib8tc,https://hilding.pl/png/product/rockroll.jpg,https://hilding.pl/produkt/materace-wysokoelastyczne_21/hilding-rock-roll_34.html ,"Rock&Roll to materac, który zwraca uwag? innowacyjnym po??czeniem dwóch wysokoelastycznych pianek uk?adaj?cych si? w intryguj?cy wzór fal oraz dwoma oryginalnymi kolorami wk?adu. Dzi?ki nim zyskujesz pewno??, ?e wybra?e? model ró?ni?cy si? z obu stron stopniem twardo?ci. Takie rozwi?zanie pozwala dostosowa? materac do w?asnych, zmieniaj?cych si? w czasie preferencji."
Cha-Cha,"11399,99",,https://hilding.pl/png/product/cha-cha.jpg,https://hilding.pl/produkt/materace-kieszeniowe-_23/hilding-cha-cha_76.html ,"Wykorzystanie spr??yn kieszeniowych w materacu gwarantuje niezwykle wysok? elastyczno?? punktow?. Ka?da spr??ynka reaguje na ci??ar cia?a osobno, nie musisz si? wi?c martwi?, ze obudzisz swojego partnera."
Tango,"12399,99",https://youtu.be/njMj7sY81Ws,https://hilding.pl/png/product/tango.jpg,https://hilding.pl/produkt/materace-kieszeniowe-_23/hilding-tango_38.html ,"Specjalnie profilowana pianka wysokoelastyczna, posiada mniej jednolit? struktur? komórkow? od standardowej pianki, dzi?ki czemu uzyskuje lepsze parametry podtrzymywania cia?a, komfortu oraz spr??ysto?ci i elastyczno?ci. Otwartokomórkowa struktura zapewnia te? przewiewno?? i wentylacj?."
Flamenco,"13399,99",https://www.youtube.com/embed/M8FdIMjCrwo,https://hilding.pl/png/product/flamenco.jpg,https://hilding.pl/produkt/materace-multipocket_24/hilding-flamenco_43.html ,Konstrukcj? materaca Flamenco oparli?my na innowacyjnych spr??ynach Multipocket. W porównaniu ze spr??ynami kieszeniowymi wyró?niaj? si? istotn? cech?: dzi?ki mniejszej ?rednicy na ka?dy metr kwadratowy przypada ich wi?cej.
Conga,"14399,99",,,,
Boogie,"15399,99",,,,
Modern,"16399,99",,,,
Dance,"17399,99",,,,
Lambada,"18399,99",,,,
Makarena,"19399,99",https://www.youtube.com/embed/-Oocg4Tsi6Q,https://hilding.pl/png/product/makarena.jpg,https://hilding.pl/produkt/materace-multipocket_24/hilding-makarena_44.html ,"Makarena to materac o w?a?ciwo?ciach przeciwodle?ynowych, w którym wykorzystali?my innowacyjne spr??yny typu Multipocket. Ka?da spr??yna znajduje si? w osobnej kieszonce i reaguje indywidualnie na ci??ar Twojego cia?a, zapewniaj?c solidne wsparcie."
Pasodoble,"20399,99",https://www.youtube.com/embed/EodQxoPYFcQ,https://hilding.pl/png/product/013-pasadoble.jpg,https://hilding.pl/produkt/materace-kieszeniowe-_23/hilding-pasodoble_39.html,"Pasodoble to model, który polecamy osobom o wi?kszej wadze lub preferuj?cym nieco twardsze pod?o?e snu. Jego konstrukcja zapewnia solidne wsparcie kr?gos?upa i ka?dej partii cia?a. Po jednej stronie wk?adu umie?cili?my warstw? maty kokosowej, która podwy?sza twardo??, zachowuj?c jednocze?nie spr??ysto?? i elastyczno??."
Rumba,"21399,99",https://www.youtube.com/embed/watch?v=aRD6hvg4-TE,https://hilding.pl/png/product/rumba.jpg,https://hilding.pl/produkt/materace-termoelastyczne_19/hilding-rumba_23.html ,"Wybieraj?c materac Rumba zyskujesz wymierne korzy?ci: termoelastyczna pianka Visco reaguje na temperatur? cia?a i dopasowuje si? ka?dorazowo do Twojej pozycji na materacu, co zmniejsza napi?cie mi??ni i gwarantuje idealne wsparcie od g?owy a? do nóg."
Salsa,"22399,99",https://www.youtube.com/embed/toacBra6DhA,https://hilding.pl/png/product/salsa.jpg,https://hilding.pl/produkt/materace-termoelastyczne_19/hilding-salsa_21.html,"Salsa to materac zbudowany na bazie wysoce plastycznej pianki Flexifoam, dzi?ki której osi?ga optymaln? sztywno??. Jednocze?nie, poprzez odpowiednie profilowanie pianki, stworzyli?my 7 zró?nicowanych stref twardo?ci, które zapewniaj? doskona?? podstaw? dla kr?gos?upa i gwarantuj? optymalne roz?o?enie punktów nacisku na materac. G?owa, ramiona, biodra i nogi zyskuj? idealne wsparcie, a wszystkie mi??nie regeneruj? si? szybciej."
